{
  "$schema": "https://json-schema.org/draft/2020-12/schema",
  "$id": "https://schemas.agent-ix.org/agent-ix/spec-artifacts-iso/FR.json",
  "type": "object",
  "properties": {
    "id": {
      "$ref": "https://schemas.agent-ix.org/agent-ix/spec-artifacts-iso/FRId.json"
    },
    "title": {
      "$ref": "https://schemas.agent-ix.org/agent-ix/spec-artifacts-iso/NonEmptyText.json"
    },
    "type": {
      "type": "string",
      "const": "FR"
    },
    "object": {
      "$ref": "https://schemas.agent-ix.org/agent-ix/spec-artifacts-iso/ObjectTypeName.json"
    },
    "status": {
      "$ref": "https://schemas.agent-ix.org/agent-ix/spec-artifacts-iso/ArtifactStatus.json"
    },
    "relationships": {
      "type": "array",
      "items": {
        "$ref": "https://schemas.agent-ix.org/agent-ix/spec-artifacts-iso/Relationship.json"
      }
    },
    "provenance": {
      "$ref": "https://schemas.agent-ix.org/agent-ix/spec-artifacts-iso/Provenance.json"
    },
    "description": {
      "$ref": "https://schemas.agent-ix.org/agent-ix/spec-artifacts-iso/Section.json"
    },
    "inputs": {
      "$ref": "https://schemas.agent-ix.org/agent-ix/spec-artifacts-iso/Section.json"
    },
    "outputs": {
      "$ref": "https://schemas.agent-ix.org/agent-ix/spec-artifacts-iso/Section.json"
    },
    "behavior": {
      "$ref": "https://schemas.agent-ix.org/agent-ix/spec-artifacts-iso/Section.json"
    },
    "constraints": {
      "type": "array",
      "items": {
        "$ref": "https://schemas.agent-ix.org/agent-ix/spec-artifacts-iso/Constraint.json"
      },
      "minItems": 1
    },
    "acceptanceCriteria": {
      "type": "array",
      "items": {
        "$ref": "https://schemas.agent-ix.org/agent-ix/spec-artifacts-iso/AcceptanceCriterion.json"
      },
      "minItems": 1
    },
    "invariants": {
      "type": "array",
      "items": {
        "$ref": "https://schemas.agent-ix.org/semantic-core/0.3.3/ClauseRef.json"
      },
      "minItems": 1,
      "description": "Formal clauses from an optional `## Invariants` section (`ocl-clause` mapping); clause text is carried beside the record, never parsed."
    },
    "dependencies": {
      "$ref": "https://schemas.agent-ix.org/agent-ix/spec-artifacts-iso/Section.json"
    }
  },
  "required": [
    "id",
    "title",
    "type",
    "relationships",
    "provenance",
    "description",
    "acceptanceCriteria",
    "dependencies"
  ],
  "unevaluatedProperties": {
    "not": {}
  },
  "description": "Functional requirement record (archetype `FR`)."
}
