{
  "acceptanceCriteria": [
    {
      "criteria": "Given a matching digest, the artifact is persisted",
      "id": "FR-001-AC-1",
      "line": 108,
      "verification": {
        "method": "Test",
        "testRefs": []
      }
    },
    {
      "criteria": "Given a mismatched digest, the import is rejected",
      "id": "FR-001-AC-2",
      "line": 109,
      "verification": {
        "method": "Inspection",
        "testRefs": []
      }
    }
  ],
  "behavior": {
    "endLine": 83,
    "startLine": 77,
    "text": "\n- The system SHALL compute the SHA-256 digest of the artifact bytes on import.\n- The system SHALL reject the artifact when the computed digest differs from the\n  declared digest.\n- The system SHALL persist the artifact only after a successful digest match.\n\n"
  },
  "constraints": [
    {
      "constraint": "Digest computation SHALL use SHA-256 only",
      "id": "FR-001-CON-1",
      "line": 88,
      "type": "Security",
      "validation": {
        "method": "Integration Test",
        "testRefs": []
      }
    }
  ],
  "dependencies": {
    "endLine": 114,
    "startLine": 111,
    "text": "\n- **Upstream**: [US-001](../usecase/US-001-artifact-import.md) artifact import\n- **Downstream**: [IT-001](../integration/IT-001-checksum-rejection.md) checksum rejection coverage\n"
  },
  "description": {
    "endLine": 66,
    "startLine": 61,
    "text": "\nThe system SHALL verify the SHA-256 checksum of every imported artifact before\npersisting it, rejecting any artifact whose computed digest does not match the\ndeclared digest.\n\n"
  },
  "id": "FR-001",
  "inputs": {
    "endLine": 71,
    "startLine": 67,
    "text": "\n- Imported artifact bytes\n- Declared SHA-256 digest from the import manifest\n\n"
  },
  "invariants": [
    {
      "clauseId": "digest_matches_declared",
      "language": "ocl",
      "sourceSpan": {
        "endColumn": 3,
        "endLine": 102,
        "path": "spec_artifacts_iso/skeletons/fr.md",
        "sourceIdentity": "ix://agent-ix/spec-artifacts-iso/skeletons",
        "startColumn": 1,
        "startLine": 98
      }
    }
  ],
  "outputs": {
    "endLine": 76,
    "startLine": 72,
    "text": "\n- Accepted artifact persisted to the store\n- Rejection error carrying the declared/computed digest pair\n\n"
  },
  "provenance": {
    "digest": "sha256:e1ae27dfa67ac390bb38f930c68a89371e6fb5b521a1e7e2d14ced30403ad07b",
    "path": "spec_artifacts_iso/skeletons/fr.md",
    "sourceIdentity": "ix://agent-ix/spec-artifacts-iso/skeletons"
  },
  "relationships": [
    {
      "target": "ix://agent-ix/example/US-001",
      "type": "implements"
    }
  ],
  "title": "Verify checksums on artifact import",
  "type": "FR"
}
